ffffffc0ea493b40 3564043913 S Ci:1:001:0 s a3 00 0000 0001 0004 4 <
ffffffc0ea493b40 3564043933 C Ci:1:001:0 0 4 = 01010100
ffffffc0ea493b40 3564043938 S Co:1:001:0 s 23 01 0010 0001 0000 0
ffffffc0ea493b40 3564043987 C Co:1:001:0 0 0
ffffffc0ea493b40 3564043991 S Ci:1:001:0 s a3 00 0000 0002 0004 4 <
ffffffc0ea493b40 3564043996 C Ci:1:001:0 0 4 = 00010000
ffffffc0ea493b40 3564043999 S Ci:1:001:0 s a3 00 0000 0003 0004 4 <
ffffffc0ea493b40 3564044019 C Ci:1:001:0 0 4 = 00010000
ffffffc0ea493b40 3564044022 S Ci:1:001:0 s a3 00 0000 0004 0004 4 <
ffffffc0ea493b40 3564044027 C Ci:1:001:0 0 4 = 00010000
ffffffc0ea493b40 3564044030 S Ci:1:001:0 s a3 00 0000 0005 0004 4 <
ffffffc0ea493b40 3564044034 C Ci:1:001:0 0 4 = 00010000
ffffffc0f7531540 3564151017 S Ii:1:001:1 -115:2048 4 <
ffffffc0ea493b40 3564151036 S Ci:1:001:0 s a3 00 0000 0001 0004 4 <
ffffffc0ea493b40 3564151058 C Ci:1:001:0 0 4 = 01010000
ffffffc0ea493b40 3564151169 S Co:1:001:0 s 23 03 0004 0001 0000 0
ffffffc0ea493b40 3564151189 C Co:1:001:0 0 0
ffffffc0ea493b40 3564203020 S Ci:1:001:0 s a3 00 0000 0001 0004 4 <
ffffffc0ea493b40 3564203036 C Ci:1:001:0 0 4 = 03051000
ffffffc0ea493b40 3564203042 S Co:1:001:0 s 23 01 0014 0001 0000 0
ffffffc0ea493b40 3564203052 C Co:1:001:0 0 0
ffffffc0ea493b40 3564255251 S Ci:1:000:0 s 80 06 0100 0000 0040 64 <
ffffffc0ea493b40 3564255646 C Ci:1:000:0 0 18 = 12011002 00000040 d118e74e 01060102 0301
ffffffc0ea493b40 3564255657 S Co:1:001:0 s 23 03 0004 0001 0000 0
ffffffc0ea493b40 3564255673 C Co:1:001:0 0 0
ffffffc0ea493b40 3564307013 S Ci:1:001:0 s a3 00 0000 0001 0004 4 <
ffffffc0ea493b40 3564307029 C Ci:1:001:0 0 4 = 03051000
ffffffc0ea493b40 3564307034 S Co:1:001:0 s 23 01 0014 0001 0000 0
ffffffc0ea493b40 3564307044 C Co:1:001:0 0 0
ffffffc0ea493b40 3564371019 S Ci:1:054:0 s 80 06 0100 0000 0012 18 <
ffffffc0ea493b40 3564371269 C Ci:1:054:0 0 18 = 12011002 00000040 d118e74e 01060102 0301
ffffffc0ea493b40 3564371283 S Ci:1:054:0 s 80 06 0f00 0000 0005 5 <
ffffffc0ea493b40 3564371387 C Ci:1:054:0 0 5 = 050f1600 02
ffffffc0ea493b40 3564371396 S Ci:1:054:0 s 80 06 0f00 0000 0016 22 <
ffffffc0ea493b40 3564371518 C Ci:1:054:0 0 22 = 050f1600 02071002 0e010000 0a100300 0f000100 0000
ffffffc0ea493b40 3564371532 S Ci:1:054:0 s 80 06 0200 0000 0009 9 <
ffffffc0ea493b40 3564371667 C Ci:1:054:0 0 9 = 09022000 01010080 fa
ffffffc0ea493b40 3564371676 S Ci:1:054:0 s 80 06 0200 0000 0020 32 <
ffffffc0ea493b40 3564371799 C Ci:1:054:0 0 32 = 09022000 01010080 fa090400 0002ff42 01040705 01020002 00070581 02000200
ffffffc0ea493780 3564371810 S Ci:1:054:0 s 80 06 0300 0000 00ff 255 <
ffffffc0ea493780 3564371926 C Ci:1:054:0 0 4 = 04030904
ffffffc0ea493780 3564371935 S Ci:1:054:0 s 80 06 0302 0409 00ff 255 <
ffffffc0ea493780 3564372063 C Ci:1:054:0 0 24 = 18035000 69007800 65006c00 20003800 20005000 72006f00
ffffffc0ea493780 3564372073 S Ci:1:054:0 s 80 06 0301 0409 00ff 255 <
ffffffc0ea493780 3564372192 C Ci:1:054:0 0 14 = 0e034700 6f006f00 67006c00 6500
ffffffc0ea493780 3564372201 S Ci:1:054:0 s 80 06 0303 0409 00ff 255 <
ffffffc0ea493780 3564372315 C Ci:1:054:0 0 30 = 1e033300 42003000 33003000 44004c00 4a004700 30003000 30004200 3500
ffffffc0ea4930c0 3564373057 S Co:1:054:0 s 00 09 0001 0000 0000 0
ffffffc0ea4930c0 3564373333 C Co:1:054:0 0 0
ffffffc0ea493240 3564373385 S Ci:1:054:0 s 80 06 0304 0409 00ff 255 <
ffffffc0ea493240 3564373594 C Ci:1:054:0 0 28 = 1c034100 44004200 20004900 6e007400 65007200 66006100 63006500
ffffffc09721d780 3564883768 S Ci:1:054:0 s c0 33 0000 0000 0002 2 <
ffffffc09721d780 3564884348 C Ci:1:054:0 0 2 = 0200
ffffffc09721d780 3564884511 S Co:1:054:0 s 40 34 0000 0000 0007 7 = 416e6472 6f6964
ffffffc09721d780 3564884781 C Co:1:054:0 0 7 >
ffffffc09721d780 3564884854 S Co:1:054:0 s 40 34 0000 0001 000c 12 = 416e6472 6f696420 4175746f
ffffffc09721d780 3564884993 C Co:1:054:0 0 12 >
ffffffc0ea493a80 3564885057 S Co:1:054:0 s 40 34 0000 0002 000c 12 = 416e6472 6f696420 4175746f
ffffffc0ea493a80 3564885224 C Co:1:054:0 0 12 >
ffffffc0ea493a80 3564885259 S Co:1:054:0 s 40 34 0000 0003 0005 5 = 322e302e 31
ffffffc0ea493a80 3564885411 C Co:1:054:0 0 5 >
ffffffc0ea493a80 3564885448 S Co:1:054:0 s 40 34 0000 0004 0000 0
ffffffc0ea493a80 3564885624 C Co:1:054:0 0 0
ffffffc0ea493a80 3564885692 S Co:1:054:0 s 40 34 0000 0005 0009 9 = 48552d41 41414141 41
ffffffc0ea493a80 3564885835 C Co:1:054:0 0 9 >
ffffffc0ea493a80 3564885859 S Co:1:054:0 s 40 35 0000 0000 0000 0
ffffffc0ea493a80 3564885937 C Co:1:054:0 0 0
ffffffc0f7531540 3564913903 C Ii:1:001:1 0:2048 1 = 02
ffffffc0f7531540 3564913911 S Ii:1:001:1 -115:2048 4 <
ffffffc0ea493a80 3564913921 S Ci:1:001:0 s a3 00 0000 0001 0004 4 <
ffffffc0ea493a80 3564913933 C Ci:1:001:0 0 4 = 00010100
ffffffc0ea493a80 3564913937 S Co:1:001:0 s 23 01 0010 0001 0000 0
ffffffc0ea493a80 3564913983 C Co:1:001:0 0 0
ffffffc0ea493780 3564915855 S Ci:1:001:0 s a3 00 0000 0001 0004 4 <
ffffffc0ea493780 3564915872 C Ci:1:001:0 0 4 = 00010000
ffffffc0ea493780 3564942021 S Ci:1:001:0 s a3 00 0000 0001 0004 4 <
ffffffc0ea493780 3564942084 C Ci:1:001:0 0 4 = 00010000
ffffffc0ea493780 3564969024 S Ci:1:001:0 s a3 00 0000 0001 0004 4 <
ffffffc0ea493780 3564969039 C Ci:1:001:0 0 4 = 00010000
ffffffc0ea493780 3564996018 S Ci:1:001:0 s a3 00 0000 0001 0004 4 <
ffffffc0ea493780 3564996033 C Ci:1:001:0 0 4 = 00010000
ffffffc0ea493780 3565023020 S Ci:1:001:0 s a3 00 0000 0001 0004 4 <
ffffffc0ea493780 3565023035 C Ci:1:001:0 0 4 = 00010000
ffffffc0f7531540 3565023060 C Ii:1:001:1 -2:2048 0
ffffffc0ea493780 3565707558 S Ci:1:001:0 s a3 00 0000 0001 0004 4 <
ffffffc0ea493780 3565707574 C Ci:1:001:0 0 4 = 01010100
ffffffc0ea493780 3565707580 S Co:1:001:0 s 23 01 0010 0001 0000 0
ffffffc0ea493780 3565707626 C Co:1:001:0 0 0
ffffffc0ea493780 3565707630 S Ci:1:001:0 s a3 00 0000 0002 0004 4 <
ffffffc0ea493780 3565707635 C Ci:1:001:0 0 4 = 00010000
ffffffc0ea493780 3565707639 S Ci:1:001:0 s a3 00 0000 0003 0004 4 <
ffffffc0ea493780 3565707643 C Ci:1:001:0 0 4 = 00010000
ffffffc0ea493780 3565707646 S Ci:1:001:0 s a3 00 0000 0004 0004 4 <
ffffffc0ea493780 3565707651 C Ci:1:001:0 0 4 = 00010000
ffffffc0ea493780 3565707653 S Ci:1:001:0 s a3 00 0000 0005 0004 4 <
ffffffc0ea493780 3565707658 C Ci:1:001:0 0 4 = 00010000
ffffffc0f7531540 3565815016 S Ii:1:001:1 -115:2048 4 <
ffffffc0ea493780 3565815030 S Ci:1:001:0 s a3 00 0000 0001 0004 4 <
ffffffc0ea493780 3565815042 C Ci:1:001:0 0 4 = 01010000
ffffffc0ea493780 3565815122 S Co:1:001:0 s 23 03 0004 0001 0000 0
ffffffc0ea493780 3565815137 C Co:1:001:0 0 0
ffffffc0ea493780 3565867028 S Ci:1:001:0 s a3 00 0000 0001 0004 4 <
ffffffc0ea493780 3565867049 C Ci:1:001:0 0 4 = 03051000
ffffffc0ea493780 3565867057 S Co:1:001:0 s 23 01 0014 0001 0000 0
ffffffc0ea493780 3565867068 C Co:1:001:0 0 0
ffffffc0ea493780 3565919262 S Ci:1:000:0 s 80 06 0100 0000 0040 64 <
ffffffc0ea493780 3565919438 C Ci:1:000:0 0 18 = 12011002 00000040 d118012d 01060102 0301
ffffffc0ea493780 3565919448 S Co:1:001:0 s 23 03 0004 0001 0000 0
ffffffc0ea493780 3565919470 C Co:1:001:0 0 0
ffffffc0ea493780 3565971015 S Ci:1:001:0 s a3 00 0000 0001 0004 4 <
ffffffc0ea493780 3565971078 C Ci:1:001:0 0 4 = 03051000
ffffffc0ea493780 3565971085 S Co:1:001:0 s 23 01 0014 0001 0000 0
ffffffc0ea493780 3565971096 C Co:1:001:0 0 0
ffffffc0ea493780 3566035023 S Ci:1:055:0 s 80 06 0100 0000 0012 18 <
ffffffc0ea493780 3566035216 C Ci:1:055:0 0 18 = 12011002 00000040 d118012d 01060102 0301
ffffffc0ea493780 3566035237 S Ci:1:055:0 s 80 06 0f00 0000 0005 5 <
ffffffc0ea493780 3566035351 C Ci:1:055:0 0 5 = 050f1600 02
ffffffc0ea493780 3566035362 S Ci:1:055:0 s 80 06 0f00 0000 0016 22 <
ffffffc0ea493780 3566035489 C Ci:1:055:0 0 22 = 050f1600 02071002 0e010000 0a100300 0f000100 0000
ffffffc0ea493780 3566035503 S Ci:1:055:0 s 80 06 0200 0000 0009 9 <
ffffffc0ea493780 3566035613 C Ci:1:055:0 0 9 = 09023700 02010080 fa
ffffffc0ea493780 3566035622 S Ci:1:055:0 s 80 06 0200 0000 0037 55 <
ffffffc0ea493780 3566035743 C Ci:1:055:0 0 55 = 09023700 02010080 fa090400 0002ffff 00040705 81020002 00070501 02000200
ffffffc0ea493000 3566035756 S Ci:1:055:0 s 80 06 0300 0000 00ff 255 <
ffffffc0ea493000 3566035861 C Ci:1:055:0 0 4 = 04030904
ffffffc0ea493000 3566035870 S Ci:1:055:0 s 80 06 0302 0409 00ff 255 <
ffffffc0ea493000 3566035989 C Ci:1:055:0 0 24 = 18035000 69007800 65006c00 20003800 20005000 72006f00
ffffffc0ea493000 3566035999 S Ci:1:055:0 s 80 06 0301 0409 00ff 255 <
ffffffc0ea493000 3566036127 C Ci:1:055:0 0 14 = 0e034700 6f006f00 67006c00 6500
ffffffc0ea493000 3566036137 S Ci:1:055:0 s 80 06 0303 0409 00ff 255 <
ffffffc0ea493000 3566036249 C Ci:1:055:0 0 30 = 1e033300 42003000 33003000 44004c00 4a004700 30003000 30004200 3500
ffffffc0ea493240 3566037117 S Co:1:055:0 s 00 09 0001 0000 0000 0
ffffffc0ea493240 3566037489 C Co:1:055:0 0 0
ffffffc0ea493a80 3566037535 S Ci:1:055:0 s 80 06 0304 0409 00ff 255 <
ffffffc0ea493a80 3566037722 C Ci:1:055:0 0 56 = 38034100 6e006400 72006f00 69006400 20004100 63006300 65007300 73006f00
ffffffc08cf72180 3566037896 S Ci:1:055:0 s 80 06 0306 0409 00ff 255 <
ffffffc08cf72180 3566038006 C Ci:1:055:0 0 28 = 1c034100 44004200 20004900 6e007400 65007200 66006100 63006500
ffffffc08cce3000 3566892951 S Bi:1:055:1 -115 4096 <
ffffffc08cce39c0 3566893076 S Bo:1:055:1 -115 10 = 00000000 00000000 0000
ffffffc08cce39c0 3566893112 C Bo:1:055:1 0 10 >
ffffffc08cce3000 3566899312 C Bi:1:055:1 0 6 = 00030002 ffff
ffffffc09721db40 3566899485 S Bi:1:055:1 -115 4096 <
ffffffc08cce3180 3571894611 S Bo:1:055:1 -115 15 = 00030006 00010001 00010000 000000
ffffffc09721db40 3581902319 C Bi:1:055:1 -2 0
ffffffc08cce3180 3581902985 C Bo:1:055:1 -2 0
ffffffc01d037300 3581989227 S Ci:1:055:0 s c0 33 0000 0000 0002 2 <
ffffffc01d037300 3581989516 C Ci:1:055:0 0 2 = 0200
ffffffc01d037540 3581989583 S Co:1:055:0 s 40 34 0000 0000 0007 7 = 416e6472 6f6964
ffffffc01d037540 3581989691 C Co:1:055:0 0 7 >
ffffffc09721d540 3581989728 S Co:1:055:0 s 40 34 0000 0001 000c 12 = 416e6472 6f696420 4175746f
ffffffc09721d540 3581989889 C Co:1:055:0 0 12 >
ffffffc01d037480 3581989928 S Co:1:055:0 s 40 34 0000 0002 000c 12 = 416e6472 6f696420 4175746f
ffffffc01d037480 3581990076 C Co:1:055:0 0 12 >
ffffffc09721d300 3581990117 S Co:1:055:0 s 40 34 0000 0003 0005 5 = 322e302e 31
ffffffc09721d300 3581990232 C Co:1:055:0 0 5 >
ffffffc01d037e40 3581990269 S Co:1:055:0 s 40 34 0000 0004 0000 0
ffffffc01d037e40 3581990370 C Co:1:055:0 0 0
ffffffc01d037e40 3581990701 S Co:1:055:0 s 40 34 0000 0005 0009 9 = 48552d41 41414141 41
ffffffc01d037e40 3581990855 C Co:1:055:0 0 9 >
ffffffc01d0370c0 3581991127 S Co:1:055:0 s 40 35 0000 0000 0000 0
ffffffc01d0370c0 3581991247 C Co:1:055:0 0 0
ffffffc0f8869840 3582994475 S Bi:1:055:1 -115 4096 <
ffffffc0acfe9c00 3582994571 S Bo:1:055:1 -115 10 = 00000000 00000000 0000
ffffffc0f8869840 3585641144 C Bi:1:055:1 -108 0
ffffffc0acfe9c00 3585641501 C Bo:1:055:1 -108 0
